Irritation,Irritación,Irritação,Irritazione,Possible Obstacle,Posible Obstáculo,Possível Obstáculo,Possibile Ostacolo,Draws attention to minor disruptions or stressors that may need addressing.,Llama la atención sobre interrupciones o factores estresantes menores que pueden necesitar ser abordados.,Chama a atenção para pequenas interrupções ou estressores que podem precisar ser abordados.,Richiama l'attenzione su piccole interruzioni o fattori di stress che potrebbero aver bisogno di essere affrontati.
Rage,Rabia,Raiva,Rabbia,Possible Obstacle,Posible Obstáculo,Possível Obstáculo,Possibile Ostacolo,"Indicates a loss of equilibrium, prompting grounding or self-regulation.","Indica una pérdida de equilibrio, lo que provoca la conexión a tierra o la autorregulación.","Indica uma perda de equilíbrio, incitando o enraizamento ou a autorregulação.","Indica una perdita di equilibrio, spingendo al radicamento o all'autoregolamentazione."
Resentment,Resentimiento,Ressentimento,Risentimento,Possible Obstacle,Posible Obstáculo,Possível Obstáculo,Possibile Ostacolo,"Signals unmet expectations or imbalance in a relationship, prompting boundary-setting.","Indica expectativas no cumplidas o desequilibrio en una relación, lo que provoca el establecimiento de límites.","Sinaliza expectativas não atendidas ou desequilíbrio em um relacionamento, incitando a definição de limites.","Segnala aspettative non soddisfatte o uno squilibrio in una relazione, spingendo a stabilire confini."
Vexation,Vexación,Vexação,"Seccatura, Vessazione",Possible Obstacle,Posible Obstáculo,Possível Obstáculo,Possibile Ostacolo,"Flags repeated irritation, calling for a shift in expectations or approach.","Señala la irritación repetida, lo que pide un cambio en las expectativas o en el enfoque.","Sinaliza irritação repetida, pedindo uma mudança nas expectativas ou na abordagem.","Segnala l'irritazione ripetuta, richiedendo un cambiamento nelle aspettative o nell'approccio."
Afraid,"Asustado, Temeroso","Assustado, Com medo","Impaurito, Spaventato",Possible Threat Toward Something We Care About,Posible Amenaza Hacia Algo que Nos Importa,Possível Ameaça a Algo que Nos Importa,Possibile Minaccia a Qualcosa a Cui Teniamo,"Alerts you to potential danger or uncertainty, prompting caution or protection.","Te alerta sobre el peligro potencial o la incertidumbre, lo que provoca precaución o protección.","Alerta para perigo potencial ou incerteza, incitando cautela ou proteção.","Ti avvisa di un potenziale pericolo o incertezza, spingendo alla cautela o alla protezione."
Alarm,Alarma,Alarme,Allarme,Possible Threat Toward Something We Care About,Posible Amenaza Hacia Algo que Nos Importa,Possível Ameaça a Algo que Nos Importa,Possibile Minaccia a Qualcosa a Cui Teniamo,"Warns you of urgent threat, pushing rapid protective action.","Te advierte de una amenaza urgente, lo que impulsa una acción protectora rápida.","Alerta para ameaça urgente, impulsionando uma ação protetora rápida.","Ti avverte di una minaccia urgente, spingendo a un'azione protettiva rapida."
Anxiety,Ansiedad,Ansiedade,Ansia,Possible Threat Toward Something We Care About,Posible Amenaza Hacia Algo que Nos Importa,Possível Ameaça a Algo que Nos Importa,Possibile Minaccia a Qualcosa a Cui Teniamo,Increases alertness and encourages preparation when facing uncertain outcomes.,Aumenta el estado de alerta y fomenta la preparación al enfrentar resultados inciertos.,Aumenta o estado de alerta e incentiva a preparação ao enfrentar resultados incertos.,Aumenta lo stato di allerta e incoraggia la preparazione di fronte a esiti incerti.
Anxious,Ansioso,Ansioso,Ansioso,Possible Threat Toward Something We Care About,Posible Amenaza Hacia Algo que Nos Importa,Possível Ameaça a Algo que Nos Importa,Possibile Minaccia a Qualcosa a Cui Teniamo,Increases alertness and prepares you to address possible threats.,Aumenta el estado de alerta y te prepara para abordar posibles amenazas.,Aumenta o estado de alerta e prepara você para abordar possíveis ameaças.,Aumenta lo stato di allerta e ti prepara ad affrontare possibili minacce.
Apprehension,Aprensión,Apreensão,Apprensione,Possible Threat Toward Something We Care About,Posible Amenaza Hacia Algo que Nos Importa,Possível Ameaça a Algo que Nos Importa,Possibile Minaccia a Qualcosa a Cui Teniamo,"Anticipates potential difficulties, helping you prepare mentally for what's ahead.","Anticipa las posibles dificultades, ayudándote a prepararte mentalmente para lo que se avecina.","Antecipa dificuldades potenciais, ajudando você a se preparar mentalmente para o que está por vir.","Anticipa le potenziali difficoltà, aiutandoti a prepararti mentalmente per ciò che ti aspetta."
Concern,Preocupación,Preocupação,Preoccupazione,Possible Threat Toward Something We Care About,Posible Amenaza Hacia Algo que Nos Importa,Possível Ameaça a Algo que Nos Importa,Possibile Minaccia a Qualcosa a Cui Teniamo,Highlights something you care about that may be at risk.,Destaca algo que te importa y que puede estar en riesgo.,Destaca algo com que você se importa que pode estar em risco.,Mette in evidenza qualcosa a cui tieni e che potrebbe essere a rischio.
Dread,"Temor, Pavor",Pavor,Paura,Possible Threat Toward Something We Care About,Posible Amenaza Hacia Algo que Nos Importa,Possível Ameaça a Algo que Nos Importa,Possibile Minaccia a Qualcosa a Cui Teniamo,Helps you recognize and avoid situations that may cause harm or distress.,Te ayuda a reconocer y evitar situaciones que pueden causar daño o angustia.,Ajuda você a reconhecer e evitar situações que podem causar dano ou angústia.,Ti aiuta a riconoscere ed evitare situazioni che possono causare danno o disagio.
Fear,Miedo,Medo,Paura,Possible Threat Toward Something We Care About,Posible Amenaza Hacia Algo que Nos Importa,Possível Ameaça a Algo que Nos Importa,Possibile Minaccia a Qualcosa a Cui Teniamo,Triggers a survival response to escape or confront immediate danger.,Desencadena una respuesta de supervivencia para escapar o confrontar el peligro inmediato.,Dispara uma resposta de sobrevivência para escapar ou confrontar perigo imediato.,Attiva una risposta di sopravvivenza per fuggire o affrontare un pericolo immediato.
Foreboding,Premonición,Pressentimento,Presagio,Possible Threat Toward Something We Care About,Posible Amenaza Hacia Algo que Nos Importa,Possível Ameaça a Algo que Nos Importa,Possibile Minaccia a Qualcosa a Cui Teniamo,"Anticipates danger without clear cause, prompting heightened awareness and caution.","Anticipa el peligro sin una causa clara, lo que provoca una mayor conciencia y precaución.","Antecipa o perigo sem causa clara, incitando a maior consciência e cautela.","Anticipa un pericolo senza una causa chiara, spingendo a una maggiore consapevolezza e cautela."
Nervous,Nervioso,Nervoso,Nervoso,Possible Threat Toward Something We Care About,Posible Amenaza Hacia Algo que Nos Importa,Possível Ameaça a Algo que Nos Importa,Possibile Minaccia a Qualcosa a Cui Teniamo,Heightens awareness and readiness for anticipated challenge.,Aumenta la conciencia y la disposición para el desafío anticipado.,Aumenta a consciência e a prontidão para o desafio antecipado.,Aumenta la consapevolezza e la prontezza per una sfida attesa.
Nervousness,Nerviosismo,Nervosismo,Nervosismo,Possible Threat Toward Something We Care About,Posible Amenaza Hacia Algo que Nos Importa,Possível Ameaça a Algo que Nos Importa,Possibile Minaccia a Qualcosa a Cui Teniamo,Helps you focus attention before a challenging task or interaction.,Te ayuda a enfocar la atención antes de una tarea o interacción desafiante.,Ajuda você a focar a atenção antes de uma tarefa ou interação desafiadora.,Ti aiuta a focalizzare l'attenzione prima di un compito o un'interazione difficile.
Panic,Pánico,Pânico,Panico,Possible Threat Toward Something We Care About,Posible Amenaza Hacia Algo que Nos Importa,Possível Ameaça a Algo que Nos Importa,Possibile Minaccia a Qualcosa a Cui Teniamo,Mobilizes immediate action when you feel overwhelmed by danger.,Moviliza una acción inmediata cuando te sientes abrumado por el peligro.,Mobiliza ação imediata quando você se sente sobrecarregado pelo perigo.,Mobilita un'azione immediata quando ti senti sopraffatto dal pericolo.
Terror,Terror,Terror,Terrore,Possible Threat Toward Something We Care About,Posible Amenaza Hacia Algo que Nos Importa,Possível Ameaça a Algo que Nos Importa,Possibile Minaccia a Qualcosa a Cui Teniamo,Floods the system with survival energy when a threat seems overwhelming.,Inunda el sistema con energía de supervivencia cuando una amenaza parece abrumadora.,Inunda o sistema com energia de sobrevivência quando uma ameaça parece esmagadora.,Inonda il sistema di energia di sopravvivenza quando una minaccia sembra travolgente.
Unease,Inquietud,Inquietação,"Malessere, Disagio",Possible Threat Toward Something We Care About,Posible Amenaza Hacia Algo que Nos Importa,Possível Ameaça a Algo que Nos Importa,Possibile Minaccia a Qualcosa a Cui Teniamo,"Signals that something might be off, prompting you to slow down and check your surroundings.","Indica que algo podría estar mal, lo que te incita a reducir la velocidad y verificar tu entorno.","Sinaliza que algo pode estar errado, incitando você a desacelerar e verificar seu ambiente.","Segnala che qualcosa potrebbe non andare, spingendoti a rallentare e a controllare l'ambiente circostante."
Worried,Preocupado,Preocupado,Preoccupato,Possible Threat Toward Something We Care About,Posible Amenaza Hacia Algo que Nos Importa,Possível Ameaça a Algo que Nos Importa,Possibile Minaccia a Qualcosa a Cui Teniamo,Helps you anticipate problems and prepare for possible outcomes.,Te ayuda a anticipar problemas y prepararte para posibles resultados.,Ajuda você a antecipar problemas e se preparar para possíveis resultados.,Ti aiuta ad anticipare i problemi e a prepararti per i possibili esiti.
Worry,Preocupación,Preocupação,Preoccupazione,Possible Threat Toward Something We Care About,Posible Amenaza Hacia Algo que Nos Importa,Possível Ameaça a Algo que Nos Importa,Possibile Minaccia a Qualcosa a Cui Teniamo,"Draws your attention to unresolved issues, encouraging planning or action.","Llama tu atención a problemas no resueltos, fomentando la planificación o la acción.","Chama sua atenção para questões não resolvidas, incentivando o planejamento ou a ação.","Richiama la tua attenzione su questioni irrisolte, incoraggiando la pianificazione o l'azione."
Assertive,Asertivo,Assertivo,Assertivo,Power Over,Poder Sobre,Poder Sobre,Potere Su,Enables novel thinking and problem-solving by linking emotion and imagination.,Habilita el pensamiento novedoso y la resolución de problemas al vincular la emoción y la imaginación.,Possibilita o pensamento inovador e a resolução de problemas ao ligar emoção e imaginação.,Abilita un pensiero nuovo e la risoluzione dei problemi collegando emozione e immaginazione.
Authoritative,Autoritario,Autoritário,Autoritario,Power Over,Poder Sobre,Poder Sobre,Potere Su,Encourages flexibility and connection through joyful experimentation.,Fomenta la flexibilidad y la conexión a través de la experimentación alegre.,Incentiva a flexibilidade e a conexão através de experimentação alegre.,Incoraggia la flessibilità e la connessione attraverso la sperimentazione gioiosa.
Bossy,Mandón,Mandão,Autoritario,Power Over,Poder Sobre,Poder Sobre,Potere Su,"Attempts to assert control over others, often reflecting unmet needs for order or recognition.","Intenta ejercer control sobre los demás, a menudo reflejando necesidades insatisfechas de orden o reconocimiento.","Tenta afirmar controle sobre os outros, muitas vezes refletindo necessidades não atendidas de ordem ou reconhecimento.","Tenta di affermare il controllo sugli altri, spesso riflettendo bisogni insoddisfatti di ordine o riconoscimento."
Commanding,"Dominante, Convincente",Dominante,Autorevole,Power Over,Poder Sobre,Poder Sobre,Potere Su,"Affirms belonging and emotional resonance with others, supporting wellbeing and trust.","Afirma el sentido de pertenencia y la resonancia emocional con los demás, apoyando el bienestar y la confianza.","Afirma o pertencimento e a ressonância emocional com os outros, apoiando o bem-estar e a confiança.","Afferma l'appartenenza e la risonanza emotiva con gli altri, supportando il benessere e la fiducia."
Controlling,Controlador,Controlador,Controllante,Power Over,Poder Sobre,Poder Sobre,Potere Su,"Attempts to impose order or predictability, often reflecting a need for safety or certainty.","Intenta imponer orden o previsibilidad, a menudo reflejando una necesidad de seguridad o certeza.","Tenta impor ordem ou previsibilidade, muitas vezes refletindo uma necessidade de segurança ou certeza.","Tenta di imporre ordine o prevedibilità, spesso riflettendo un bisogno di sicurezza o certezza."
Dominant,Dominante,Dominante,Dominante,Power Over,Poder Sobre,Poder Sobre,Potere Su,"Sparks vision and energy for growth, innovation, or meaningful action.","Despierta la visión y la energía para el crecimiento, la innovación o la acción significativa.","Acende a visão e a energia para crescimento, inovação ou ação significativa.","Accende visione ed energia per la crescita, l'innovazione o un'azione significativa."
Forceful,"Contundente, Enérgico","Enérgico, Forte","Energico, Forte",Power Over,Poder Sobre,Poder Sobre,Potere Su,"Asserts strength to influence outcomes, useful when decisive action is needed.","Afirma la fuerza para influir en los resultados, lo que es útil cuando se necesita una acción decisiva.","Afirma a força para influenciar resultados, útil quando uma ação decisiva é necessária.","Afferma la forza per influenzare gli esiti, utile quando è necessaria un'azione decisa."
Imperious,Imperioso,Imperioso,Imperioso,Power Over,Poder Sobre,Poder Sobre,Potere Su,"Communicates urgency or certainty, which may support leadership or strain relationships.","Comunica urgencia o certeza, lo que puede apoyar el liderazgo o tensar las relaciones.","Comunica urgência ou certeza, que pode apoiar a liderança ou tensionar relacionamentos.","Comunica urgenza o certezza, che può supportare la leadership o mettere a dura prova le relazioni."
Influential,Influyente,Influente,Influente,Power Over,Poder Sobre,Poder Sobre,Potere Su,"Reflects ability to shape outcomes or perspectives, often strengthening leadership or impact.","Refleja la capacidad de dar forma a los resultados o perspectivas, a menudo fortaleciendo el liderazgo o el impacto.","Reflete a capacidade de moldar resultados ou perspectivas, muitas vezes fortalecendo a liderança ou o impacto.","Riflette la capacità di modellare gli esiti o le prospettive, spesso rafforzando la leadership o l'impatto."
Overbearing,Autoritario,Autoritário,Prepotente,Power Over,Poder Sobre,Poder Sobre,Potere Su,Signals over-assertion that may mask insecurity or urgency to be heard or respected.,Indica una sobreafirmación que puede enmascarar la inseguridad o la urgencia de ser escuchado o respetado.,Sinaliza excesso de afirmação que pode mascarar insegurança ou urgência em ser ouvido ou respeitado.,Segnala un'eccessiva affermazione che potrebbe mascherare insicurezza o urgenza di essere ascoltati o rispettati.
Powerful,Poderoso,Poderoso,Potente,Power Over,Poder Sobre,Poder Sobre,Potere Su,"Affirms capacity to take action and effect change, reinforcing a sense of agency.","Afirma la capacidad de tomar medidas y efectuar cambios, reforzando un sentido de capacidad de agencia.","Afirma a capacidade de tomar ação e efetuar mudança, reforçando um senso de agência.","Afferma la capacità di agire e di cambiare, rafforzando un senso di autonomia."
Superior,Superior,Superior,Superiore,Power Over,Poder Sobre,Poder Sobre,Potere Su,"Highlights perceived strength or advantage, which can motivate responsibility or dominance.","Destaca la fuerza o la ventaja percibidas, lo que puede motivar la responsabilidad o el dominio.","Destaca a força ou a vantagem percebidas, que podem motivar responsabilidade ou dominação.","Mette in evidenza la forza o il vantaggio percepiti, che possono motivare la responsabilità o il dominio."
Accommodating,Servicial,Prestativo,Accondiscendente,Power Under,Poder Bajo,Poder Sob,Potere Sotto,Highlights your ability to creatively navigate challenges using available tools.,Destaca tu capacidad para navegar creativamente por los desafíos utilizando las herramientas disponibles.,Destaca sua capacidade de navegar criativamente em desafios usando as ferramentas disponíveis.,Mette in evidenza la tua capacità di affrontare creativamente le sfide usando gli strumenti disponibili.
Compliant,Complaciente,Complacente,Accondiscendente,Power Under,Poder Bajo,Poder Sob,Potere Sotto,Sustains focus and persistence in the face of obstacles or challenge.,Mantiene el enfoque y la persistencia frente a los obstáculos o desafíos.,Sustenta o foco e a persistência diante de obstáculos ou desafios.,Sostiene la concentrazione e la persistenza di fronte a ostacoli o sfide.
Deferential,Respetuoso,Respeitoso,Deferente,Power Under,Poder Bajo,Poder Sob,Potere Sotto,Channels emotional energy toward action that aligns with meaningful goals.,Canaliza la energía emocional hacia una acción que se alinee con metas significativas.,Canaliza a energia emocional em direção a ações que se alinham com objetivos significativos.,Canalizza l'energia emotiva verso azioni che si allineano con obiettivi significativi.
Docile,Dócil,Dócil,Docile,Power Under,Poder Bajo,Poder Sob,Potere Sotto,"Affirms your ability to handle what’s needed, reinforcing self-efficacy.","Afirma tu capacidad para manejar lo que se necesita, reforzando la autoeficacia.","Afirma sua capacidade de lidar com o que é necessário, reforçando a auto-eficácia.","Afferma la tua capacità di gestire ciò che è necessario, rafforzando l'autoefficacia."
Humble,Humilde,Humilde,Umile,Power Under,Poder Bajo,Poder Sob,Potere Sotto,"Affirms alignment between effort, achievement, and personal or social values.","Afirma la alineación entre el esfuerzo, el logro y los valores personales o sociales.","Afirma o alinhamento entre esforço, conquista e valores pessoais ou sociais.","Afferma l'allineamento tra sforzo, realizzazione e valori personali o sociali."
Meek,Manso,Manso,"Mite, Docile",Power Under,Poder Bajo,Poder Sob,Potere Sotto,Anchors sustained effort to a goal or relationship that aligns with your values.,Ancla el esfuerzo sostenido a una meta o relación que se alinee con tus valores.,Ancoras o esforço sustentado a um objetivo ou relacionamento que se alinhe com seus valores.,Ancorra lo sforzo sostenuto a un obiettivo o a una relazione che si allinea con i tuoi valori.
Obedient,Obediente,Obediente,Obbediente,Power Under,Poder Bajo,Poder Sob,Potere Sotto,"Signals trust in your abilities, encouraging purposeful and resilient action.","Indica confianza en tus habilidades, fomentando una acción decidida y resiliente.","Sinaliza a confiança em suas habilidades, incentivando uma ação proposital e resiliente.","Segnala la fiducia nelle tue capacità, incoraggiando un'azione mirata e resiliente."
Passive,Pasivo,Passivo,Passivo,Power Under,Poder Bajo,Poder Sob,Potere Sotto,Reflects readiness to act in alignment with your values and sense of agency.,Refleja la disposición para actuar en alineación con tus valores y sentido de agencia.,Reflete a prontidão para agir em alinhamento com seus valores e senso de agência.,Riflette la prontezza ad agire in allineamento con i tuoi valori e il senso di autonomia.
Resigned,Resignado,Resignado,Rassegnato,Power Under,Poder Bajo,Poder Sob,Potere Sotto,"Signals successful recovery from stress, reinforcing your inner strength and adaptability.","Indica una recuperación exitosa del estrés, reforzando tu fuerza interior y adaptabilidad.","Sinaliza a recuperação bem-sucedida do estresse, reforçando sua força interior e adaptabilidade.","Segnala un recupero di successo dallo stress, rafforzando la tua forza interiore e adattabilità."
Subdued,"Sometido, Apaciguado","Submetido, Abatido",Sottomesso,Power Under,Poder Bajo,Poder Sob,Potere Sotto,"Concentrates attention on what matters most, reducing distraction and enhancing effectiveness.","Concentra la atención en lo que más importa, reduciendo la distracción y mejorando la efectividad.","Concentra a atenção no que mais importa, reduzindo a distração e aprimorando a eficácia.","Concentra l'attenzione su ciò che conta di più, riducendo le distrazioni e migliorando l'efficacia."
Submissive,Sumiso,Submisso,Sottomesso,Power Under,Poder Bajo,Poder Sob,Potere Sotto,"Validates completion or fulfillment of a goal or need, reinforcing competence.","Valida la finalización o el cumplimiento de una meta o necesidad, reforzando la competencia.","Valida a conclusão ou o cumprimento de um objetivo ou necessidade, reforçando a competência.","Convalida il completamento o la soddisfazione di un obiettivo o di un bisogno, rafforzando la competenza."
Yielding,Cediendo,Cedendo,Cedevole,Power Under,Poder Bajo,Poder Sob,Potere Sotto,Reminds you of your capacity to cope with or influence challenging situations.,Te recuerda tu capacidad para hacer frente o influir en situaciones desafiantes.,Lembra você de sua capacidade de lidar com ou influenciar situações desafiadoras.,Ti ricorda la tua capacità di affrontare o influenzare situazioni difficili.
Bliss,"Dicha, Felicidad","Felicidade, Dicha","Beatitudine, Felicità",Presence of Love,Presencia de Amor,Presença de Amor,Presenza d'Amore,Reflects a deep need for change or support when all options seem lost.,Refleja una profunda necesidad de cambio o apoyo cuando todas las opciones parecen perdidas.,Reflete uma necessidade profunda de mudança ou apoio quando todas as opções parecem perdidas.,Riflette un profondo bisogno di cambiamento o supporto quando tutte le opzioni sembrano perdute.
Contentment,Satisfacción,Satisfação,Appagamento,Presence of Love,Presencia de Amor,Presença de Amor,Presenza d'Amore,Urges withdrawal to conserve energy and evaluate unmet emotional needs.,Insta a la retirada para conservar energía y evaluar las necesidades emocionales no satisfechas.,Instiga a retirada para conservar energia e avaliar necessidades emocionais não atendidas.,Sollecita il ritiro per conservare l'energia e valutare i bisogni emotivi insoddisfatti.
Delight,Delicia,Deleite,Delizia,Presence of Love,Presencia de Amor,Presença de Amor,Presenza d'Amore,Honors loss or change and helps integrate meaning into your experience.,Honra la pérdida o el cambio y ayuda a integrar el significado en tu experiencia.,Honra a perda ou a mudança e ajuda a integrar o significado em sua experiência.,Onora la perdita o il cambiamento e aiuta a integrare il significato nella tua esperienza.
Ecstasy,Éxtasis,Êxtase,Estasi,Presence of Love,Presencia de Amor,Presença de Amor,Presenza d'Amore,"Alerts you to emotional or physical pain, prompting protection or healing.","Te alerta sobre el dolor emocional o físico, lo que provoca protección o curación.","Alerta para dor emocional ou física, incitando proteção ou cura.","Ti avvisa del dolore emotivo o fisico, spingendo alla protezione o alla guarigione."
Elation,"Euforia, Júbilo","Exaltação, Alegria","Euforia, Giubilo",Presence of Love,Presencia de Amor,Presença de Amor,Presenza d'Amore,"Indicates acceptance of what can’t be controlled, helping preserve energy.","Indica la aceptación de lo que no se puede controlar, ayudando a preservar la energía.","Indica a aceitação do que não pode ser controlado, ajudando a preservar a energia.","Indica l'accettazione di ciò che non può essere controllato, aiutando a preservare l'energia."
Euphoria,Euforia,Euforia,Euforia,Presence of Love,Presencia de Amor,Presença de Amor,Presenza d'Amore,"Allows for emotional processing after loss, fostering healing and remembrance.","Permite el procesamiento emocional después de la pérdida, fomentando la curación y el recuerdo.","Permite o processamento emocional após a perda, fomentando a cura e a lembrança.","Consente l'elaborazione emotiva dopo la perdita, favorendo la guarigione e il ricordo."
Fulfillment,Realización,Realização,Realizzazione,Presence of Love,Presencia de Amor,Presença de Amor,Presenza d'Amore,"Indicates perceived lack of control, prompting you to seek support or simplify demands.","Indica una falta de control percibida, lo que te incita a buscar apoyo o a simplificar las demandas.","Indica a falta de controle percebida, incitando você a buscar apoio ou simplificar as demandas.","Indica una percepita mancanza di controllo, spingendoti a cercare supporto o a semplificare le richieste."
Happiness,Felicidad,Felicidade,Felicità,Presence of Love,Presencia de Amor,Presença de Amor,Presenza d'Amore,Signals emotional exhaustion and the need to reconnect with purpose or support.,Indica un agotamiento emocional y la necesidad de reconectarse con el propósito o el apoyo.,Sinaliza exaustão emocional e a necessidade de se reconectar com o propósito ou apoio.,Segnala un esaurimento emotivo e il bisogno di riconnettersi con lo scopo o il supporto.
Joy,Alegría,Alegria,Gioia,Presence of Love,Presencia de Amor,Presença de Amor,Presenza d'Amore,Helps you prepare for potential setbacks by anticipating difficulties.,Te ayuda a prepararte para posibles contratiempos al anticipar las dificultades.,Ajuda você a se preparar para possíveis contratempos antecipando dificuldades.,Ti aiuta a prepararti per potenziali battute d'arresto anticipando le difficoltà.
